{
  "manifest_type": "paper_model_matrix",
  "manifest_version": 1,
  "status": "frozen",
  "request_dimensions": {
    "tasks": ["repair_proposal", "track_diagnosis"],
    "prompt_regimes": ["zero_shot", "static_few_shot"],
    "context_bundles": ["logic_only", "local_graph"]
  },
  "generation_identity": [
    "case_payload_sha256",
    "task",
    "rendered_prompt_sha256",
    "context_sha256",
    "model_revision",
    "inference_parameters_sha256"
  ],
  "models": [
    {
      "model_id": "ollama_qwen3_30b",
      "provider": "ollama",
      "model": "qwen3:30b",
      "model_revision": "ad815644918f0eaab341c12b67837cc6dd4562342cdaf118f83d5d554cb37226",
      "revision_status": "resolved",
      "revision_resolution": "local_ollama_registry_digest",
      "population": "main-1200",
      "execution_mode": "sync",
      "temperature": 0,
      "top_p": 1,
      "seed": 13,
      "context_length": 32768,
      "max_output_tokens": 8192,
      "ollama_think": "enabled",
      "max_transport_retries": 2,
      "tools_disabled": true,
      "expected_calls": 9600
    },
    {
      "model_id": "ollama_llama3_3_70b",
      "provider": "ollama",
      "model": "llama3.3:70b",
      "model_revision": "a6eb4748fd2990ad2952b2335a95a7f952d1a06119a0aa6a2df6cd052a93a3fa",
      "revision_status": "resolved",
      "revision_resolution": "local_ollama_registry_digest",
      "population": "main-1200",
      "execution_mode": "sync",
      "temperature": 0,
      "top_p": 1,
      "seed": 13,
      "context_length": 32768,
      "max_output_tokens": 8192,
      "ollama_think": "disabled",
      "max_transport_retries": 2,
      "tools_disabled": true,
      "expected_calls": 9600
    },
    {
      "model_id": "ollama_gpt_oss_120b",
      "provider": "ollama",
      "model": "gpt-oss:120b",
      "model_revision": "a951a23b46a1f6093dafee2ea481d634b4e31ac720a8a16f3f91e04f5a40ecd9",
      "revision_status": "resolved",
      "revision_resolution": "local_ollama_registry_digest",
      "population": "main-1200",
      "execution_mode": "sync",
      "temperature": 0,
      "top_p": 1,
      "seed": 13,
      "context_length": 32768,
      "max_output_tokens": 8192,
      "ollama_think": "high",
      "max_transport_retries": 2,
      "tools_disabled": true,
      "expected_calls": 9600
    },
    {
      "model_id": "azure_gpt_5_6_sol_high",
      "provider": "azure",
      "model": "gpt-5.6-sol",
      "deployment": "gpt-5.6-sol-2026-07-09",
      "model_revision": "gpt-5.6-sol-2026-07-09",
      "revision_status": "resolved",
      "revision_resolution": "azure_data_plane_models_endpoint_exact_snapshot_id",
      "population": "azure-600",
      "execution_mode": "sync",
      "reasoning_effort": "high",
      "max_output_tokens": 8192,
      "max_transport_retries": 2,
      "tools_disabled": true,
      "expected_calls": 4800
    }
  ]
}
